{
  "id": "classic-niameowdb-news",
  "name": "NiaMeowDB MapleStory Classic News",
  "series": "classic",
  "regions": ["china", "global"],
  "languages": ["en"],
  "source_type": "community-site",
  "content_types": ["news"],
  "base_url": "https://meowdb.com/msclassic",
  "discovery_urls": ["https://meowdb.com/msclassic/news"],
  "feed_url": null,
  "api_url": null,
  "sitemap_urls": [],
  "adapter": "html",
  "parser": "classic-niameowdb-news",
  "adapter_config": {
    "default_content_type": "news",
    "link_selector": "a[href*=\"/msclassic/news/\"]",
    "include_patterns": ["/msclassic/news/[^/?#]+$"],
    "external_id_pattern": "/msclassic/news/([^/?#]+)$",
    "body_selector": "article"
  },
  "official": false,
  "enabled": true,
  "crawl_frequency": "6h",
  "rate_limit": { "requests": 1, "per_seconds": 5 },
  "requires_javascript": false,
  "requires_login": false,
  "storage_mode": "summary-and-metadata",
  "robots_policy": "respect",
  "last_checked": "2026-07-25T00:00:00.000Z",
  "last_success": null,
  "last_error": null,
  "notes": "Verified on 2026-07-25 as a fan-run editorial index that summarizes Global Nexon, China Shengqu, and relevant third-party Classic World developments and links each entry to its original source. Crawl stores metadata and summaries only; individual claims remain non-official until checked against the linked primary source."
}
